serial,text,sentiment
26,"The Wick films now have something in cormmon with another popular franchise; the
Road Runner cartoons. Wick is now more invulnerable than Wolverine. Last movie
they dropped him off of a building. In this one they do the same but why stop
there; they drop him off two buildings with nary a scratch. Wick just gets up and
keeps on killing. Who cares right? Certainly not reviewers and critics who are giving
this cartoonish movie high praise. But why stop there? Let's let him get hit by no
less than 4 moving cars that would have shattered bones in a mere mortal. But
let's go for more. Let's drop him not once but twice down hundreds of stairs only
for him to get up and kill dozens more. My wife ( having loved the first 3) was
thoroughly disgusted with this movie and I was quite dismayed myself. Wick
peaked in the second brilliant one but they turned this into a stupid Fast and
Furious movie defying what punishment a body can take. Wick is not hurt once
except in the final gun battle. The movie gets a few stars for the cinematography,
stunts and the great first big action action scene in Japan with the equally great
Hiroyoki Sanada. Sadly the movie goes downhill from there. Watch for cartoon fun
only.
",negative
27,"In my opinion this is by far the worst movie of the franchise. It's just way too over
the top. Everybody seems to have magical jackets now to stop the bullets.

Audience loved the dogs on the third one so that just lazily copied one here also
but didn't bother to have any real cool scenes with it.

I'm happy they made John Wick 1 but since then every movie getting worse and
worse. This one was already so bad that I regret spending any money to see It.

People shooting and dying in center of Paris but police doesn't seem to care.

John Wick getting shot, falling from great heights etc without any issues.
",negative
28,"I really liked the first 3. And really hated this one. I thought the action sequences
were stupid like one that reminded me of the scene in Hot Rod where Andy
Samberg goes flying down and a hill and doesn't stop for miles. Apparently this is
one of John Wick's new superpowers, to be able to survive long falls. The Scout
character is extra stupid and unnecessary. I don't understand his motivation.
There's too many characters here that are supposed to be important. I just found
everything confusing and redundant. There may have been one or two scenes that
I liked but J can't even think which they are. Keannu is too slow now to pull these
fight scenes off. Donnie reprises his role from Star Wars Rogue One. I just think it's
a messy movie.
",negative
29,"So full of ideas I am sure I need to watch it a lot more. Yeah it was great on the big
screen. Like being there. Like you are a drone looking in on the action. Yeah some lemon
haze half way in was a good choice for me. Better than a video game! Hard to believe I
did not know so many of the spoilers since 1 followed the online info pretty closely. Over
the last few pandemic years. Keanu is the quintessential action movie star. John Wick IS
the wrathful deity. I have heard it will be available for streaming in May. T'll be running it
all day.

Not for kids. Do NOT let your ex husband take little kids cuz he wants to see it. The good
news is that it has intergenerational appeal as long as you are over 14 .
",positive
30,"What is all the raving about with this movie? I felt it lacked a decent storyline and was 2
hours and 35 mins of fighting while the remaining 10 or so minutes was acting.

The usual far too long fighting scenes where he does his usual MMA moves by getting the
enemies head between his legs while he reloads his gun and shoots him the head.

For me it was at least an hour too long and could have been much shorter, The storyline
was very weak and after such a long gap between this and John Wick 3 I am surprised it
was written better.

I also have no idea why this review has to be a minimum go 600 characters?

Yes we.
",negative
31,"Parabellum (part 3) was my favorite and as is the case in many sequels, hard to keep
topping your last go- not in the case of the John Wick team. They keep figuring out ways
to keep the story interesting, delivering on the action set pieces and adding to the lore in
a very effective and stylish way. John Wick 4 was an absolute pleasure to watch. It was
full of entertainment. Despite being almost 3 hours long, it does not have boring
sections. The non-action scenes have interesting characters, drama and incredible
production design. John Wick continues to raise its own bar. As in the previous entries,
each action set piece is distinguished and powerful. This Is one of those movies that must
be watched on the big screen.
",positive
32,"My son and I love the John Wick movies but both agreed this was really bad. There were
a few creative aspects to the fight scenes, cinematography and effects, but in terms of
the writing the whole movie was just one long incessant fight scene repeated what felt
like hundreds of times without any story to break it up or make any of it matter at all to
the viewer. In action movies it's obviously about the action and not much is needed to
make the story ‘matter’ but my goodness at least have the basics of an actual story that
makes the action compelling in some basic way. There were a number of excellent actors
in this movie but sadly the writing made it so that even they couldn't contribute anything
to the story. Went in excited but I seriously wanted to walk out about half way through

when I realized it was just going to be non-stop fight scenes and nothing else for 3 whole
hours. It was truly mind-numbing
",positive
33,"""john wick chapter 4"" whole new level of action set pieces

| wouldn't say this movie is a masterpiece, but the action sequences make this one a
highly worth watch in theaters. What else does anyone expect from a john wick movie.
The last one hour of this movie is just like blazing fire. Keanu reeves, i dont think i can
see him in any other character unless he cuts his hair or something. He just shines in the
action sequences and embodies this character completely. All the extras and other actors
give an amazing performance. Action sequences, top notch. Cinematography, top notch.
Music, top notch.
",positive
34,"John Wick Chapter 4, directed by Chad Stahelski and stars Keanu Reeves as the
main character John Wick. This is the best film of 2023, already. There I said it. It's
already the best film of 2023. John Wick's Chapter 4 1s one of the best action films
this decade. I enjoy this film, no; I loved this film. I loved this film, My dad and I
watched John Wick's Chapter 1 on opening day, and now we watched it on opening
day; and Chapter 4 didn't disappoint us at all; we had the best time with this film.
Bill Skarsgard, Donnie Yen, and Scott Adkins were brilliant in this film, and they
didn't disappoint us in this film as it's such a good plot during this film. The story is
well done as it shows and expands the new assassin world. And the action, I can
keep going on and on about the action and I am so anticipated that I want to see
the movie again, of how good the action is especially the overhead scene that was
inspired by Hotline Miami. That scene alone made this film a masterpiece. I could
watch it over and over again and I will never get tire of watching it. The story is
really good and the ending was a huge plot twist, as we though there were going to
make Chapter 5. And in all honesty if they end the story here with John Wick, that
would be okay, because, I seriously don't know how on god's earth will they top
this film. And If they ever do a Chapter 5, Please bring everybody back that did
Chapter 1-4 for Chapter 5. My dad and J are huge fans and we will continue be
fans, we love the film and for my dad it's already the best film of 2023 in his eyes.
Cinematography, soundtrack, visuals are ALL astounding. There is only a nitpick
and that is John Wick still is clean after all the fighting. Overall, John Wick's
Chapter 4 is a true masterpiece of action filmmaking, It's a film that manages to
exceed the high bar set by its predecessors, delivering a thrilling and emotionally
engaging experience that leaves you wanting even more. If you're a fan of action
movies or just great filmmaking in general, then John Wick Chapter 4 is an
absolute must-see film. I give it a 10/10 rating without reservation. I am wanting
this film to get this film a billion dollars at the box office, Because it deserves the
money, and time to see on the BIG screen. I am going ta see this film over and
over again. It's a masterpiece. 10/10.
",positive
35,"This has to the best action movie I have ever seen, I have to say I'm shocked to see the
4th movie in a cinematic universe be the best yet. It's non stop action from start to
finish. Keanu is one of the greatest action stars to ever live. I really hope they make
more. The fight choreography is second to none, the gun play better than ever, and the
casting is stupendous. The plot is top notch, the Wickverse is better than the Marvel
Universe and any film universe. He deserves all the plaudits for what he has done with

this character. You need to see this movie multiple times. Best film I have seen at the
cinema in a very long time.
",positive
36,"John Wick 4 is an incredible addition to the action franchise. The film takes the series to
new heights with even more intense fight scenes and a thrilling storyline that keeps you
on the edge of your seat. Keanu Reeves delivers another outstanding performance as the
iconic hitman, and the supporting cast brings their A-game as well. Without giving away
any spoilers, I can confidently say that John Wick 4 exceeds all expectations and is a
must-see for fans of the series and action movie lovers alike

it's the best John wick and all of the characters that are added do an amazing job beat
villains.
",positive
37,"From the very beginning to the end, nothing but endless kills, fighting, close combats,
bloods squirts or splashes, KR after four chapters, he looked older, slower and tiresome.
The screenplay was so pretentious and pointless, the dialog looked forced and boring,
katana swords vs. Bullets, and almost every bullet could be fenced off by the katana
sword blades. The scenarios and the plots just kept stacked up without any reason or
clue, just kill, kill, kill...nothing but kills. All the fighting sequences just like Shaw
Brothers’ 1970s poor and laughable Hong Kong martial art movies, heavily
choreographically staged, looked so forced and fake. Every kill was not killed with one
bullets but many, yet the handguns seemed equipped with endless bullets, bang, bang,
bang, even the fallen guys already dead, but still needed to be shot several times more
to increase the violent sound effect. I don’t know what's the purpose of making these 4th
Chapter, and I think the ist Chapter only needed a following 2nd Chapter to end it, but
what the heck, brainless young viewers need bloody fights, more dead bodies, ridiculous
screenplay with clueless storyline, no real plots or real story really needed, just created
something like violent video games.

When John Wick fought for his life in the Japanese hotel against so many clueless foes
and the Zatoishi-like blind swordsman played by Donny Yen with a Botox injected face,
we all decided to quit at the same time.

Hey, it's time to wrap it up, guys, no sense to continue to Chapter 5: You've Been
Conned, AGAIN!
",negative
38,"For nearly 10 years we have been treated to the joy that are the John Wick movies. The
nicest guy in hallywood has been able to reinvent himself into one of the baddest hitmen
ever to be played on screen! The 4th installment is no exception

Ive seen a lot of reviews and reports surrounding this movie and the state that John Wick
had found himself in the last 2 installments. Wick 2 i would say hes fighting at 30% hp
and Parabellum around 1hp and still managing to slay very time. This time round hes
back to full health and ready to take on everyone who stands in his way.

With the sudden passing of Lance Reddick im sure they had multiple stories for his
character as it sounded very much from the press tour that his character was going to be
round for a while after this mavie. Nonetheless he went out in the way that his character
has always been, dignified.

Less just say one thing that the villain of any movie deserves credit for making a movie
just as epic as it can be and Bill Skarsg4rd is no exception here. Typical man at the top
that gets everyone else to do his dirty work. Clancy browns Harbinger is awesome and a
great addition to the mystery that surrounds the world of the hitman for hire.

I cannot fault this film yet again, action movies for years to come will be looking back on
this to create an epic fight scene half as well as the smallest of scenes in this film. Just
one more thing to say that a fight scene between 2 factions of Ninjas is just as epic as
ever before.
",positive
39,"Think it's gone too far past how great JW1 was, just over hyped now. How is all this
action happening with no police any where?

A blind man shooting people but no one can shoot him ?? The main body guard for
the main villain should of been killed plenty of times,JW puts bullets in people who
you know are dead but leaves this guy in the middle of the road when he's the
main threat??How is all the violance happening in the street and night club and no
one batters an eye lid ??why did he leave the underground to go to the church
that's obviously miles away to then end up in a shootout ? Surly he got of go there
easier ? The overlay of the radio DJ at the end was annoying,how did she know
where he wa aging to be constantly??
",negative
40,"This is by far the best action movie to come out the past 15 years! Yup, I said it and
stand by it! Can you find a movie character more exciting than John Wick?? Jason Bourne
is a close second but the visuals in this franchise make this series fun to watch.

Fast forward to this installment where the stakes are higher for John Wick. There are a
lot of twists and turns in this one, along with some of the best fight choreography in
movies. The longer running time didn't really seem like much since the pacing of this film
is fast and exciting.

One note: Lance Reddick's final onscreen performance was sentimental to watch. It's
hard not to think about what happen recently with his passing while promoting this
movie. Other supporting characters make it woke up until the very end but Reddick will
be missed.
",positive
41,"This chapter of JW was really amazing; action-packed, compelling, funny and star-filled
was definitely enthralled and it never left you anywhere but on the edge of your seat. I
found it to be engaging, funny, and thrilling white still feeling heartwrenching and
shocking in so many different and unexpected ways. It was a movie that our entire fam
enjoyed and I feel Keanu hit the ball out of the park, per usual. This franchise is

cummarized in a hittarcuoeat way hit the ride ie warth the andinn navarthalece Chun hi)
",positive
42,"John Wick: Chapter 4 is the culmination of the entire series and represents the perfection
of all of the different ideas and concepts that have been toyed with up until now. The
film's lengthy runtime flies by, with every second of it earned. It not only delivers top
notch inventive action sequences, a Hotline Miami inspired climax which will leave you
mesmerized, and a satisfying payoff to the earlier entries’ elaborate world building, but it
accomplishes all that with such visual and auditory style and finesse that it honestly sets
a new standard for martial arts films moving forward. John Wick: Chapter 4 is a crowning
achievement for the genre.
",positive
43,"This chapter of JW was really amazing; action-packed, compelling, funny and star-filled. 1
was definitely enthralled and it never left you anywhere but on the edge of your seat. I
found it to be engaging, funny, and thrilling while still feeling heartwrenching and
shocking in so many different and unexpected ways. It was a movie that our entire family
enjoyed and I feel Keanu hit the ball out of the park, per usual. This franchise is
summarized in a bittersweet way but the ride is worth the ending nevertheless. Five huge
stars for a wonderful ensemble cast! Loved this movie and really think most fans will too.
",positive
44,"Ridiculous, ultra violent and nearly 3 hours long ‘John Wick: 4° is pure escapism at its
finest. No one goes to see a ""John Wick’ movie for anything remotely close to realistic
fights or gun battles- it's about the body count, hand to hand combat and just how far
the director will take things as John absorbs so much abuse yet hardly comes away with
a scratch!

Tusually avoid movies like this however will admit it took my mind off the daily crap of
life. This one is much better than the last one- Halle Berry's character was more annoyin
to me than a female killing machine complement to Keanu Reeves' character.

There are scenes in Paris, New York and Berlin - topnotch cinematography that surpasse:
the other films. And the fight scenes are well scripted- kudos to the work Reaves and the
stunt people put in to make them outrageously entertaining!

Is this the last film in the series?

Maybe... However if this brings in a ton of money rest assured there will be another one.
",negative
45,"Yes, you can absolutely feel the length, there is no way you wouldn't feel the length,
besides the obvious, nit picky here and there, John Wick: Chapter 4 fills with the best
character in the franchise so far, Bill Skarsg4rd was a menacing great villain, another best
one in the franchise, Donnie Yen was a badass in this rnovie, and Keanu Reeves as the
great John Wick, killing it again in the role, and the rest of the cast were all great, John
Wick: Chapter 4 was the grandest of them all, in terms of a story and action, clocking at
2 hours and 49 minutes, Wick's at his god mode giving some of the most brutal, exciting,
and epic action scene in movie history, as a whole, John Wick: Chapter 4 was really
something else, something that you never seen before, in it's length, the movie offers
you a whole complete story fills with an exciting, intense, brutal, and epic action, great
story, and great characters, it's a hell of a great wild memorable one time movie watch
experience, second best in the franchise below Parabellum and above the rest.
",positive
46,"Wtf, 10s from people? This was the worst one yet and Chapter three sucked ass!
Over, over the top. People dancing while others are killed around them, cars keep
driving on like a damn marry go round even though people are killed like flies. He
survives being hit by a car at full speed not once but 5! Times in 5 minutes. Oh,
and falls from a building (again) and totals the car but just walks off.

And then they try to be funny with the dog biting nuts, him rolling down the stairs
like it's an episode of Family guy.

And to top it all off, the blind guy shoots better than John f'n Wick
Give me a f'n break

The only reason for not giving it a 1* is cus I like Keanu.
",negative
47,"My God! I just got back from a movie theatre and man! Oh man! John Wick : Chapter 4
is the best sequel of the series and one of the greatest action films ever made! You've got
so many amazing stars, awesome fight scenes and stunts with a straight up simple plot
that is kill or be killed in its absolutely biggest way in this spectacular sequel... Keanu
Reeves is always the show stealer as its titular character with his badass performance
and stunts... Ian McShane, Laurence Fishburne and the late, great Lance Reddick reprise
their roles and as usual they were great... Also I've got to say the new cast of the John
Wick franchise, Donnie Yen, Bill Skarsgard, Scott Adkins, Clancy Brown, Hiroyuki Sanada
and the rest of them were all awesome as well... So far I feel this is my number 1 movie
of the year... If you're already a John Wick fan, you're gonna be mindblown in your seats
and if you're not, trust me, you're gonna be a fan soon...
",positive
48,"He should set an example for the rest of the action films, as John Wick's character
is not an ordinary character. I hope a statue of him will be placed inside the
Hollywood Museum. In terms of photography, it is very good and second to none,
as well as accuracy and adjustment on some small things. They have great
capabilities, and we do not forget the sound and other effectsWe waited for John
Wick for a long time, just waiting for the showtime in Iraq cinema, to feel alive
thanks to this elephant. Thank you Keanu Reeves and thank you to everyone who
contributed to this wonderful work, we thank you from the bottom of our hearts.
",positive
49,"im more of a story/plot type of audience and this was just action packed, throw the
storyline right out the window type of movie.

Action junkies...this ones for YOU!

At any rate, this was absolutely horrible writing. For the last 3 Wicks, every decision just
brought him back to square one. Its an endless loop. A writers nightmare when you dont
have a story that progresses.

Where this really shines is the cinematography, and fight choreography. Stunning work by
the everyone on the crew. Pretty amazing the type shots they were able to get in and
had some really good one shots. The fights scenes are awesome but just kinda got old
when the movie is nearly 3 hours long.

 

Entertaining film... would def say it was worth the money.
",positive
50,"The stunt-work is amazing, let's start with that.

Editing is quite nice. So is photography. Acting is not much needed in the movie. At least,
acting is not needed as much as stunts. I mean, the action scenes are - how can I put
this delicately - impossible or borderline fantasy level unless the whole film is in The
Matrix, and also the third film, of course.

The character development does not exist, physics does not defy John Wick ever. The
opposite cannot be said, though.

Even if you turn off your brain and watch, most of it does not make sense, at all.
However, if you are into mindless, illogical action scenes, John Wick is the film for you
One more thing, in a gun fight, if you lose to a guy who cannot see, in brightly lit
environments, maybe you should give up your career as an assassin. If not, you deserve

to get killed in ""action"". One intriguing character was Mr. Nobody, unfortunately, though,
the writers bestowed upon him the part of Martha (Batrnan vs Superman) in this movie.
",negative
51,"Its also ridiculous,. Outrageous, ludicrous, and hilarious. They have uncut action scenes
that last for minutes now. Easily the overall best action stunt movie for the art. Simple
story and Wick indestructible. But so worth it. Fighting up an endless staircase against
innumerable foe to the music of Justice. Bravo. The most imaginative chorography fight
scenes I have ever seen. They push the limit, the intensity, the absolute insanity how can
it not be the perfect action movie created. From fists to firearms this movie does not miss
a beat. The best of the best of the best fight scenes. Take a bow.
",positive
52,"I like to watch people getting killed. Give me a movie where people are getting killed for
3 hours and I'll be happy. Then you've come to the right place in Hollywood. Hollywood is
for the mob what was once the arena in ancient Rome, but the light version, The rabble,
ignorant, feasting on big screens where violence is shown as necessary, tough and sexy.
John Wick is like American porn: do you like chocolate? Then we'll drown you in it. The
film has a total lack of drama, a total lack of imagination and, even worse, a total lack of
humour, After the umpteenth headshot I look bored at my lukewarm popcom. Kenau
Reeves, the Internet's darling of good deeds, plays a depressed killer in a black suit who
does nothing but kill people. A feast to watch for the poor in spirit. Hollywood: we've got
millions and what do we do? Portraying human ugliness like it is sexy.
",negative
53,"This is a tough one. Not only to review, but also to watch. Never before have I seen a
movie where the opponents are so obviously taking turns attacking. There are countless
scenes in this movie where John Wick is fighting multiple opponents and every one
except the one he is currently fighting is dancing around awkwardly in the background
until its their turn to attack. It's infuriating. And it happens constantly throughout the
movie

Now, not everything about the action is bad. Some of the fight scenes are awesome,
mostly the ones where he is fighting someone one on one.

The camera work, scenery, set design are all beautiful. Even the story of this installment
is better than what we had previously. The movie also introduces a couple of fantastic
new characters and the conclusion is quite satisfying.

All that to be completely underminded by the truly atrocious fight choreographies
throughout the movie. They made this an absolute chore to watch at times.
",negative
