serial,text,sentiment
0,"John wick chapter 4 is the best of the John wick series, and that was very hard to do
after the first three. From start to finish it is a pure adrenaline rush.

The acting is top notch - Keanu reeves it top quality as always - Winston and the Bowery
king are acted amazingly - but the two new character who stole the show were Donnie
Yen as Caine and Mr Nobody - really awesome characters - hope to see mare of them in
the future.

For me - this is the best action film of all time
The choreography - the set pieces - the insanely violent action and the camera work is all
done to perfection. Genuinely brilliant from start to finish, Chad Stahelski is also top

quality and has defiantly come to his own as a director.

I cannot recommend this movie enough - I cannot find a flaw in the 2h 49m run time
(which only feels like 2h). Do yourself a favour and see it in cinema.
",positive
1,"John wick is a power house of action movie franchise, 1-3 were incredible for being an
advancement in cinematography and choreography and incredible stunt work, so when
they announced a fourth one, well, I was anticipating yet another awesome movie.

I was... Half wrong; while giving me the action I wanted they stretched it for 3 hours
with dead unimportant dialogue. 0 emotion.

Every time they built tension in a scene and they stretched it too long, making the
tension tiresome and boring, leaving me waiting for the action scenes to keep the plot
going.

In conclusion, for a fourth film that concludes a series, like the matrix, they should've let
it go at the 3rd film.
",negative
2,"Greetings from Lithuania.

""John Wick: Chapter 4"" (2023) played out the way one could expect from this franchise in
term of plausibility. It is unrealistic in every possible way, yet its made in a way that it
looks real. And this is the biggest strength of Chapter 4. You have to leave all plausibility
at the door before watching it. Because when the movie starts - you are in for one
unforgettable ride.

Not only Chapter 4 is the best from the 4 movies now, it also puts to shame all action
films I've seen in many years. Its incredible movie on purely moviemaking terms. Stunt
team, choreography of fights, chases and kinetic cinematography are all put in a way I
don't think I haven't seen in Hollywood action film yet. I won't spoil anything, but one
particular action set piece near the end left me with my jaw dropped - the way it was
filmed looked kinda like a video game but so amazing at the same time. Creators really
outdone themselves with this film. And action aside (and there is more then enough of
it), | loved how confidently this movie was directed.

Overall, ""John Wick: Chapter 4"" is the best action film I've seen in many years. Reminded
me of ""Raid 2"" but with bigger scale and way bigger budget. This one has to be seen on
big screen - this one incredible action film. And running time almost 3 hours didn't felt
dragay - its superbly paced. One of the very best films of the year so far.
",positive
3,"If you want to watch fighting for 3H, beyond a rational setting, this is the movie to do it.
I was well-produced, but it was almost exclusively fighting and shooting, mayhem for a
long time, no police

There was really not complexity to the story. I would give the story a 3 or 4, really, just
nothing really there. However, because the action was good and I like Kineau Reeves, I
gave it a 7/10.

Tan McShane is always fantastic, and Bill Skarsgard was a good arrogant villain. IP Man,
Donnie Yen, was fine. The fight scenes were so long you could go to the bathroom and
come back and it would still be going on, not missing much but more fighting.

I am not surprised about the high viewer ratings, but I am surprised by the high critics
rating, because simply not a lot of story.
",negative
4,"This movie is amazing on all levels.

Best time spend in the cinema in a long long time.
So many perfect shots. Loved it big time.

If you like action adrenalin movies, you will love this.

I watched all the John Wick movies 3 times, and this will definitely get a rewatch when it
comes out on blueray. This is a must have.

Great Cast, Great acting, Great koreografi, Great kamera angles, Great action, awesome
music. Loved the tempo og the movie.

As an old dude (36), i'm very impressed with all the work Keanu Reeves puts his body
through. I felt beat up in my own body, so many times during this movie. Keanu Reeves,
just like Tom Cruise are some of the few, last real action Heroes <3.
",positive
5,"This fil is unmatched, unparalleled and out-skills any action film ever made in the
history of cinema...it Is in a category of its own. Keanu Reeves is a martial arts badass
menace. John Wick Chapter 4 needs no introduction and there are literally NO WORDS to
describe the masterpiece that I have just witnessed in the cinema. Which is the only way
to see this and do it justice. Part 1 was insane and Chapter 2 was crazy amazing, but I
actually skipped Chapter 3 as Halle was very boring in the first hour. However I knew
with Bill Skarsgaard as the villain, the Swedish actor known for IT, that this should not be
missed as dude can act. Well Lo and behold nothing prepared me for the fight scenes, the
BODY COUNT, the 99 lives of John. Donnie Yen is amazing end of story. Keanu is
everything. And the cinematography and the locations in Europe are breath-taking. ..like I
watched the most beautiful dream. Lord Jesus Christ the Berlin club scene, The fight
sequence on Paris's Arc de Triomphe, speechless. Let's just say that Chad Stahleski gave
us violence with a capital V in its most artistic form. He's the Michaelangelo of cinema.
Deepness, love, fear and fatigue. Remember the insane fight scene on motorbikes in
2017's The Villainess, a messy Korean revenge masterpiece? Well ALL of John Wicks fight
scenes are this but on steroids. Respect and Rest in Peace Lance Reddick.
",negative
6,"Unrealistic ridiculous fight scenes with Kevlar suits have ruined the last two installments
of what could have been a great film series. The elongated fight scenes have been hard
to bear. The staircase sequence was the icing on the cake for over the top hilarious
overdone nonsense. Everyone and anyone sitting in the movie theater was shouting
""c'mon"" on almost every overdone scene. If they had just stuck to a more believable
approach this movie would have been an hour shorter and a lot more bearable to say the
least. I left the movie ready wondering why the director(s) didn't see the flaws in the 3rd
installment with the cartoonist fight scenes and go back to the drawing board. Definitely

reminded me of a Michael Bay film smh.
",negative
7,"After watching this at the cinemas in America with my Mum and Dad here's my spoiler-
free review of John Wick: Chapter 4! As usual, I'll be talking about my thoughts, what I
enjoyed most about this film and my conclusion/rating! Keanu Reeves returns as John
Wick & he's fun to watch, Donnie Yen as Caine is Bad A since watching his fight scenes in
Rogue One as Chirrut Imwe and now this, Ian McShane as Winston is awesome and even
pays tribute to the late great Lance Reddick who sadly passed away from Ischemic heart
disease! My favourite part of watching this movie was the action scenes they're so well
done & very well choreographed! Overall I enjoyed this more than Shazam! Fury of the
Gods that's why I'm giving this an 8/10! There is a post-credit scene at the very end so
don't go anywhere until that's finished! ;-)
",positive
8,"I really don't understand how this movie garnered such a high score. I felt like I
was in a Star Wars sequel with people either running or being shot at for almost 3
hours. Cinematography was fabulous and it did take you to other countries in a
realistic and enjoyable way, however, so if you could sit back and enjoy that, it was
worth it

I believe Keanu Reeves’ immortality outperformed Mel Gibson in the Lethal Weapon
series after being shot about 84 times, thrown down flights of stairs multiple times
and off buildings - and no - the Kevlar suit wasn’t convincing to me.

Whereas blind people can do amazing things, Reeves’ love-hate relationship with a
former friend was not convincing.

In college, I learned that fiction still works if it is at least somewhat believable in its
own setting. This one missed the mark.
",positive
9,"Well thats what john wick movies are. If you find it fun to watch a lot of shooting
and fighting these are your movies. I watched it with my teenage son. Went out of
the theater twice during the movie to get some popcorn and a go to the toilet. Did
it deliberatley during the fight scenes. Didnt feel like T missed anything. Wick
rolling down the stairs reminded me of Neymar. How dumb and boring was that.
Before that, he fell from a Sth floor to the street and got up without problem. Even
my son found that to be too much. The New York Russians appear to be in a
Catholic church. Baba Jaga they keep refering to is not the bogeyman. Its an old
woman, thats what baba means. Something like a witch. But whatever. The good
thing in the movie are some colorful protagonists. I cannot but think these people
giving 10 stars have a vested interest to do so.
",positive
10,"These mnovies have always outdone themselves, but here we are with an actual “epic”.
John Wick: Chapter 4 continuously punches above its weight with bigger and better ...
well, everything. The lighting is better, the staging is more impressive, the fight
choreography is absolutely insane. The excess here is the point, and it's never been more
satisfying. The entire Osaka sequence feels like a marathon; then he's gun-battling in a
speeding Barracuda; and there's even a setpiece built around stairs. The man even fights
a guy in traffic.

TRAFFIC!

1 freely admit that I'm that guy in the theater that squealed when the nunchucks came
out (and they weren't a one-and-done either, he just kept beating people!)

This gave me the ""Top Gun: Maverick"" kind of high; an impeccably-paced three hours of
sustained adrenaline. I don't think such enjoyment of bone-crunching violence is normal,
but I don't care. This movie was an absolute blast!
",negative
11,"Although this latest installment was a tad bit longer than the rest of these movies in the
series it was every bit worth it. With the introduction of a few martial arts Legends the
movie took the series to the next level.

The creative Geniuses behind some of those long single shot fight sequences deserves a
hats off. A couple of them really stand out. One overhead shot of John Wick running from
room to room fighting his enemies And the other with John Wick, Donny Chen and group
fighting in a room filled with art pieces made of bulletproof glass.

The climax was one to behold as well.
On the whole it was a fun John Wick experience with a lot of entertaining fight sequences

that makes it worth your money and time. And if you are a John Wick fan, this was what
you were waiting for, and it's not going to disappoint you
",positive
12,"John Wick: Chapter 4 is one of the most exciting,hyperkinetic and beautiful action movies
ever made. Director Chad Stahelski has make a name because of this franchase. Chad
has crazy,modern ideas. We see how Keanu was saying about 300 words but on the right
spot. Baba Yaga is fighting versus High Table and we see Marquis who is Bill Skarsgard.
Wow!!! He actually was the right actor for this role. I was shocked by Akira she deserved
series or movie. Winston again with crucial role In this movie. This movie is D category or
16+ and this have a lot of blood and fights. This movie is perfect deserve to watch!!!
",positive
13,"Directed by Chad Stahelski, John Wick Chapter 4 continues the struggle of John Wick
(Keanu Reeves) with the price on his head ever increasing, he finally uncovers a way to
get free of The High Table for good. But he must face off against a new enemy with
powerful alliances across the globe.

Since this franchise started in 2014 with the release of its first movie, I'm in awe of how
this franchise has come. I had no clue what they gonna bring in the final chapter since
the last three movies always set the bar higher for the next, especially the action
sequences. And somehow they still did it and 1 think it's a perfect culmination and the
best movie probably not just in the franchise but also in modern action movies ever. The
amount of story and action is quite perfectly balanced, it's kinda an improvement from
Chapter 3 which I think is just endless action from the beginning. They also introduced a
lot of exciting and interesting new characters each with enough backstory to understand
their relationship with each other and their connection to the story

Donnie Yen, Bill Skarsg&rd, and Scott Adkins are simply phenomenal. Scott Adkins is
almost unrecognizable in prosthetics and a fat body suit and we definitely need to see
more of Bill Skarsg§rd playing this type of role, he nailed it, The technical aspects are
jaw-dropping, spanning from camerawork, stunning visuals and colors, and gorgeous
cinematography to production and sound design. Some movies, especially action flicks
definitely have one if not more memorable sequences, well John Wick: Chapter 4 is
packed with over-the-top and memorable action sequences, the stunt choreography is
truly flawless.

Salute to director Chad Stahelski for delivering the John Wick movies that were distinct
from the others and closing them perfectly, he really saved the best for the last one (or
there might be more). I'm excited to see where this franchise is gonna be taken next.

Don't let the length fool you, you won't feel it as soon as you hop in for an exhilarating
ride:
",positive
14,"I, just like many others, went in with high expectations because of the anticipation of this
movie, and amazingly enough, did not disappoint as well as exceeded my expectations!

As a newcomer to the John Wick franchise, but having been aware of it for a very long
time, I really love these films, particularly the first one. After watching Parabellum, and
slightly wondering if the caliber and scope of it can be overtaken, I was gladly mistaken
after seeing this film. The IMAX experience was breathtaking and impactful, so if given
the opportunity, definitely don't miss out. But, watching it in a regular cinema is also
equally good. While I don't want to spoil, J find that the movie felt way shorter than it's
2h 49m runtime, as 1 felt that Parabellum felt around 20 minutes too long. So if runtime
worries you, I can assure you that it is not a problem, but a positive.

The movie left me highly satisfied and breathless, so massive props and respect to
everyone involved in superseding the other entries and reinvigorating the action genre. It
really feels like a once in a lifetime example of a genuinely impactful action movie. Please
watch it and I feel that a 10 is worthy simply because of enjoyable nature, which the
movie leans into. It does everything an incredible movie needs, and easily makes it one
of the best movies as of late, and the apex of this amazing franchise! Also props to Keanu
Reeves for inhabiting this character as well, as nobody brings it like him.
",positive
15,"First of all, I went into this 4th installment of John Wick with little expectations. I was
thinking that 3 movies were perfect to end on. The perfect trilogy, why ruin it with even
more installments? And I generally thought they would somehow mess up this movie?. I
am now deeply ashamed that I thought that way, because this turned out to be much,
much better than what I expected, hell even better than the previous installments (in my
honest opinion).

This was the 2nd John Wick movie I saw at the cinema and once again, it was an
amazing experience. The action was constant. It was relentless, it was bloody and it was
just even mare constant. I felt like it would never let up. I freaking loved every second of
it. They really went fully into town with this, especially with that star studded cast
starring Donnie Yen, Yuri Boyka himself (Scott Adkins) and of course some familiar faces
from the previous installments. This was by far my favorite John Wick installment.
",positive
16,"loved the movie. It was a slightly longer movie. The action scenes and fight scenes
were also very good. Keanu Reeves was perfect for this rale. Yeeahh :) Some scenes in
the movie bothered me. Especially the scenes of not bleeding and cops scenes, but still, 1
think it was very good. It was fun to watch in the cinema, Same scenese were funnish. It
wasn't necessary. Also, the shooting scenes were very good. At the same time, the disco
scene, the scene shot from above, looked very epic. I was blown away by these scenes.
The ending of the movie was a bit simplistic so the ending was disappointing.
",positive
17,"This is honestly the best John Wick film since Chapter 2. My grandpa and I saw it
last Friday and yo, it was a blast for both of us because both are love with these
action movies. You can try understand John Wick: Chapter 4 is somewhat different
such as Caine, the deuteragonist, he's send to kill John which is antagonistic and
deadly; but you latter corne sympathize with him due to his goal to save his
daughter from execution.

I personally respect him for giving Shimazu Koji a honorable death in battle,
although Koji's daughter Akira wants revenge for that. Meanwhile with all the
bounties and man-hunts, I'll say it’s practically all Santino's fault for forfeiting
John's life due to his desire to join the High Table and over run New York with the
Camorra.
",positive
18,"As an action movie this is perfection, John Wick has always been true tu it's essence , it's
not trying te be anything else that what it is !

This film delivers action at its purest state. The Berlin sequence it's just perfect , the
music, the stunts , the characters and the John Wick universe has to stay here forever.

The biblical references and John's resolution are well stated. Do not try to analyze this
movie as something that is not trying to be.

Remember what this franchise is all about, revenge, action, weapon skills, martial arts
and most important of all, a Hitman's redemption story!

John Wick 4 delivers | It's a 10/10 Thanks to all the genius behind this project , yo have
made the best action film franchise in history
",positive
19,"Keanu always did what exactly he good in making a great movies series.
John wick is a character that he fight for love justic and good john wick is note a hero ,
he is a human , but he was a man makes his enemies liked him this move should stay on

best 250 movie list.

Every single actor , actress , director , camera man , producing team and writers was
doing his best and the get right what they want.

I like that this is the last John Wick movie because The way that the movie end is
fabulous and makes me (as John Wick fan) feel good and pleased

I like to say thanks to keanu , director ,writer and the hole team about this action movie .
",positive
20,"As a cinephile and decades of watching action movies, one is not as tantalized by the
mere act of killing and car chases. What Wick 4 attempts to do is bring the action to
another level on top of the prior 3. Not an easy task given the relentless killing and video
game level of endurance the main character has. It is akin to the experience of watching
Fast and Furious. We know no one could survive the falls and gun fights, and that is part
of the fun. The audience is in on the joke sort of speaking. Dialogue is used sparingly.
The mystery of the High Table, the almost religious codex that is followed by the criminal
organization gives the movies a greater meaning than perhaps the sum of its parts.
Reeves is a perfect fit, and we cheer for him as he appears to be the best most
conscientious of the worst the org has.
",negative
21,"And those who cling to life... dies!

This movie was an absolute blast! One of the best action movies i have seen in quite a
while and perhaps the best movie of the franchise!

The odds and stakes have yet again been risen and John has to fight like never before,
coming to terms with who he is! This was an intense and emotional ride with amazingly
choreographed fight scenes that transcends what you would deem possible in a movie!
Outstanding use of marcial arts and many of the scenes are insanely well shot with
incredible long takes that will stick with you! Some out of this world set pieces!
Soundtrack was amazing as well and gives you just the vibe you need!

Caine was by far my favorite addition to the movie! He steals every scene!

This movie shows how you can still make one of the best action moviez without using
CGI! Honestly its mindblowing how good this movie is! The almost 3hr. Runtime, flew by!
",positive
22,"Many enemies attack John but they like to attack him one at a time because they're
respectful and wait their turn.

The story line does not exist, just shooting. It starts off with John shooting some random
Arabs and an important black character just gets randomly killed off.

The bullets have no impact on John. Falling off a 5-story building has no impact on him
either. Just gets up. But the movie is not called ""Superman.""

The dialogue was written by a 12 year old.
It tries to be funny by having a dog bite the testicles off one of the bad guys and then
pee on that dead bad guy. Seems to have worked because almost the entire theater

burst into laughter.

If you're one of dumb guys, go ahead and click ""No"" on the ""Was this review helpful?""
",negative
23,"Just how much cash can you get out of a cash cow? As the John Wick producers know
that's plenty of dough but with each iteration the movies become ever more flabby and
contrived. The Hollywood formula has been employed; copy a previous success adding
ever more crash bang and wollop and of course stretching the whole thing out to a dreary
3 hour run time. But of course Hollywood misses the point, yet again. What made the
original Wick movie interesting was the character's struggle to make a new life only to be
dragged back into the criminal underworld. Granted it's an interesting and novel criminal
underworld but now it's the world of John Wick which is the focus, not Wick himself. Time
to call it a day.
",negative
24,"Let's be honest if, by now, you choose to see a “John Wick"" movie then you know what's
coming. Several hours of hyperkinetic, over the top violence with a pounding soundtrack
and moody lighting. On this front ""John Wick: Chapter 4"" delivers and then some.

There isn't a plot that I can recall but once again our favourite assassin is wrestling with
the unseen High Table and the price on his head is increasing faster than post-Covid
inflation. So every goon in a suit is out to collect and John has to wade through a tsunami
of bodies in order to, well, keep killing people.

Clearly there's no logic here as John has no identifiable motive anymore or even an end-
goal in mind. Instead he's the main character in a video game and you're watching a
Twitch stream of someone talented playing all the way through to the final boss.

At one point this characteristic is cemented, in spectacular fashion, when the camera
shifts to a top-down view and you get to watch John move from room to room in a bloody
spree. It's a fantastic sequence, right down to the spray of blood as henchmen #89 gets
shot in the head at close range.

So Is it a great film? Well yes because ""John Wick: Chapter 4"" plays it straight down the
line and sticks religiously to its aesthetic. There are no in-jokes here, in fact there are
more grunts than dialog, and the film absolutely believes in itself. On that front it's a
right belter.
",positive
25,"Inever read the good reviews in anything. Movies, Tv, Videogames... Never... I always
read the bad reviews only.

When i see many reviews that say “worst movie ever"" the chances are high that the
movie is decent and worth a view. Those people never watch actually bad movies or they
would know that there is no one worst movie ever... There is thousands of them...

When | see many reviews that say ""I'll never get those 2 hours back"" or ""i wasted 2 hours
of my life"" | know that the movie is pretty good and I'm gonna like it. To those people...
Just sleep less time some days. Even 5 minutes less a day can get you your wasted hours
back in no time...

But when | see even just one review that complain about that the fourth movie of a
franchise is the worst and the whole franchise sucks and yet they have sit through the
whole franchise since they are able to criticize it, then the movie is a masterpiece... And
Chapter 4 is a masterpiece... Enjoy if you are an action fan, you deserve this + + +

Update: When i see reviews with the expression ""Are people blind""? The movie is
probably an 11/10. Blind people have their other senses very enhanced and know better
from people with mediocre levels of all of their sense and are completely ignorant about
what subjective means...
",negative
