serial,text,sentiment
127,"The entire plot of this movie was utterly meaningless. John Wick accomplishes
absolutely nothing aside from getting all of his friends killed in his efforts to get
away from the High Table, and all that sacrifice was meaningless in the end. From
the way that the characters kept claiming that you can't change your nature, and
how nothing meaningful changed in the end, I can only conclude that the
pointlessness was the point.

Should we try to better ourselves? No, says this movie. Should we try to better the
world? No, you can't do that claims this movie.

People, this movie claims, are nothing more than idiotic sheep that will just keep
doing what they are doing, even as people are being brutally murdered right before
their eyes. I remembered enjoying the first movie, but giving money to this
disgusting piece of propaganda was a mistake.
",negative
128,"Most of the negative reviews cover why this movie is so bad. It's just unbelievably the
same thing over and over again for too long. I'm pretty sure out of the hundred of people
that were murdered in this movie, they were the same 5 stunt actors over and over

again.

I went with my buddies to this movie. Afterward we all thought this movie was horrible.
One thought it was a comedy, because of the way the killings happen. I felt the assassins
trying to kill Wick could have been soccer moms with no fighting experience, it was that

off at how they could miss shooting a guy standing next to him. I dozed off for about 10

minutes.
",negative
129,"With the sudden rash of mass shooting, murder , etc going on in our country today, this
is one movie that shouldn't have been made. We got to many crazies dope addicts that
will take this movie seriously and the next thing you know their out there trying to be
John Wick, It was hard for me to even pretend this movie was good. Hundreds of trained
fighters died and thousands of rounds were shot and John Wick being the one they were
after never once took a bullet or sliced opened with a sword. Even getting hit by high
speed cars about four times, he still walks away. Unrealistic Science fiction!
",negative
130,"It's very stupid, no character drama, no monologues, no sense, only fight which reminds
a mediocre action game with 1000 life saves, I didn't like it. A blind fighting master?
You'are kidding me? The blind man won't be able to find the way out of the cinema
auditorium by himself not even thinking of fighting and shooting in different locations. It
looks like the directors and stuntmen wanted to show what else they can do. Look: a new
stunt, look, one more or let't try this one... The first john wick was a fresh air, the forth -
air from the old bathroom with a leaking toilet. My advice- wait for a video release.
",negative
131,"I wasn't interested in watching this movie because I knew what I'm going to get, but my
friend told me that we've watched Chapter 3, and we've come this far, so we might as
well just watch chapter 4. The result was just as I expected. It was just the same as
Bullet train and other movies produced from the same production. Just another typical
villains and typical fight scenes over and over. This John Wick production team or
""franchise"" has transitioned into a new Fast and Furious franchise making the same
movies again and again by replacing cars and gimmicks. If they pivot and make some
tums to adapt new ingredients that we've tasted from the first John Wick movie, then it
would be still enjoyable, but it’s too late to stop this ""cliche train” starting from John Wick
chapter 3, Nobody, Bullet Train, Violent night, and this John Wick: Chapter 4. I don't
think this franchise will die any time soon. They are probably working another movies in
John Wick universe right now.
",negative
132,"Same ol same ol nothing new through the entire movie and ending was more boring and
dull. I almost feel asleep throughout this movie the other John wick movies were much
better and believable. I'm just keeping it real this final movie if it is the final one was not
as good as the first two and John wick just needed to make it more interesting more real
there were some scenes were I was like this would never be in real life and why not add
some better bad guy characters they looked like fruitcakes in this movie super soft .this
was not what I was expecting and should have been better scripted and the fight scenes
not overdone with the same ol same ol
",positive
133,"This mostly CGI movie with a now and then mumble grunt coming from Keanu Reeves is
net a Crime Action Thriller, it's a Fantasy World Comedy, and is an hour too long, and so
bullet repetitive it become more boring than bat ****, Is made for very simple thinking
and unintelligent movie standards. Pathetic. Struggled to stay, was yarning my head off,
there was nothing real about this movie. The many parents in my cinema taking their 10
year old sons to watch this movie, in a state of Australia with record skyrocketing child
crime rate in the headlines the past 2yrs, shows you the type of human moronic
intelligence enjoying this rubbish.
",negative
134,"I have never written a movie review ever but I am compelled to write this one. This is

most idiotic, nonsensical movie ever made. What do you get out of 180 minutes of killing
people? Nothing.

I understand John Wick itself is a genre but pushing a genre to it's extreme with total
lack of sanity is nothing but treating the audience as fools. And thinking that your

audience will watching anything that calls itself John Wick and has Keanu playing the role
is disrespecting your own audience
",negative
135,"It would be understandable if JW was a terminator(not a human assasain), but as that it
is not understandable how can he fall from 4th floor of a building, bend a car and be left
without a scratch and perfectly able to walk(and many other simillar situations).
Blindman appears to feel where are distant people to shoot but he can not feel where is
JW even when he is breathing heavily next to him. 20 people shooting at him (some even
wait for their turn) and none of them can hit. In conclusion all the shooters were blind,
drunk and drugged or wind have blown the bullets away. Sadly, at the end a man who
survived all the impossible things even for a movie dies from superficial wound.
",negative
136,"If you are flying in plane and this is only movie they have and you need to watch it, you
will most probaubly ask them to throw you out of plane or to stop showing it. It is insult
of a movie. So many bulits was shoot, that i imagine tha factory that produce those fake
bulits, is very reach now. On other side, Reeves is to old (58 years) for this kind of a role
He is walking like a old guy, not to mention that he can not run. So, if you are

somewhere wher it is cold outside or to hot, and only way to warm yourself or cool down,
is to go in cinema and watch this movie, maybe it is better outside.
",negative
137,"I was really excited about this movie since It had such good reviews in here. Now I know
that I won't be trusting any IMDB reviews ever again - So far the worst movie I've ever
seen.

I can't believe they managed to stretch 20 minutes script into 3 hours. Plot didn't move
forward at all. Fighting scenes were EXTREMELY long and unrealistic. Acting was poor and
hard to watch. Dialogues that were apparently meant to be « funny » were the corniest
I've ever heard

To be honest I would watch Shark Tornado or Twilight rather that this.

Do yourself a favor and use your spear 3 hours to something else. This wasn't worth of
the money or the time.
",negative
138,"Very very bad story, chaotic motives Outplayed protagonist by the villains

Very few fresh action elements and the old ones are really robotic and under
choreographed... boring.

I really don't understand why is rated above 7.4

For me this move was a bit of parody as well, but not in the good way :) Really don't
understand why it is needed in this way after the first 3 movie

If you cut the first 30 minutes and the last2 this could be the worst movie in the
franchise but still ok.

Watching the first action scenes with the so robotic and boring actions... time to retire
retire the franchise.
",negative
139,"I was super excited to watch the John Wick 4 movie and went with my cousin to the
cinemas. Paid a bomb for the tickets and the popcorn... 15mins into the movie and i was
wondering am i really watching chapter 4 !!

My cousin and i was laughing throughout the film as it felt like a comedy movie more
than an action film... more than a john wick film..... chapter 4 has no story !!

It felt like a movie was presented to fill a 4 year gap... and they captialized on the john
wick franchise to mint.

I could not bear to waste a moment more of my time on this utter crap... however with
the amount of money paid to watch this nonsensical theatrics we stayed...dont ever
recommend the movie to anyone... - JUST DON'T.

 

 
",positive
140,"Horrible ! 90% of the film is shooting and killing. If I wanted to, I would play a shooting
video game. Where was the film for God's sake if we take out the shooting and killing
scenes.

No, “look for the truth and bear the consequences"" and ""those who cling to death don't
die"" type cliche words don't do it for me. I will not be surprised if this movie is sponsored
by the gun lobby. Shame on you whoever participated in producing this.monstrosity.

Keanu, of all the people I did not expect this from you. Frankly I was relying mostly on
your name when I decided to buy a ticket. How can you go this low?
",negative
141,"John Wick, its a movie with more plot holes than bullet holes!

Alot of the stuff happening in this movie makes no sense. The action scenes are to long,
not well coordinated and the beauty from the first movie is gone.

Alot of the characters are meaningless and only makes the movie drag out for too long.
They also have the power of teleportation.

The plot of this movie goes nowhere and means nothing. The ending is terrible and is a
far-grab of ending the story.

One scen in this movie is good, the scene with the fat dude. That scen was ok.

Skip this movie, go watch John Wick (chapter 1) again
",negative
142,"ALL reality must be suspended for this totally unbelievable film. Can't believe I wasted
and of my precious time on this trash. The fight scenes were well choreographed,
however that's all the film is, just one fight after another with Reeves surviving clearly
unsurvivable situations, to the point where the audience was just laughing. If it is meant
to be a comedy, then it isn’t that funny, it this is not a film that you can take seriously
either!!

  

Won't be watching any more Wicks films, that's for sure. Highly disappointing trip to the
cinema, which in any event is rare these days, as so many films are below par.
",positive
143,"The John Wick movies have run out of ideas and just rehash the other movies. Keanu is
still stiff and half asleep throughout the movie and luckily they give him very little
dialogue. The other actors are superb especially Donnie Yen, who is an actual martial
artist. He's so good he makes Keanu look especially bad. Scott Atkins is great and his
martial arts skill shines in this movie

The plot is ridiculous as usual and the killing count is very high. It seems like the director
enjoys the same backgrounds.....church, falling down lots of steps, dance hall where
everyone keeps dancing even though there is gunfire.

 

It lacks the humor of the Taken movies and great acting in the Equalizer.
",positive
144,"Before there was a story, and a lot of shooting, now there is just shooting and no story
pief, paff poef. Everybody's dead.??? Is this a metaphor for the current society? Did I
mention the movie is way too long we watched this in IMAX and my ears were hurting
from the gun noise. The fighting scenes are pretty awesome and the scenery is nice, but
I think good movie needs more than justice this. I wouldn't recommend to watch this at
home and not in the theatre. You can have a break and adjust sound yourself. I do hope
there won't be a sequel for movies of the same character must be enough, Just make a
video game of it.
",positive
145,"I paid $10 usd to see this movie at a matinee. The eye candy made the price worth
it. That said, eye candy is almost all this experience offers. Most everyone involved
in this film seemed like they were sleepwalking when the action stopped. It doesn't
matter - everything in this picture is done for style points. There's barely any story
here at all, and what story exists is so thin that it could be told in about 2 minutes
of this 169 minute film. The remaining attempt to tell a story is so full of holes
supported by bad acting and bloated style that it would have been a much better
film just to leave it all out and just show a montage of fight sequences.

The Marquis character never shows the ability to do anything except sneer in an
outrageous French accent and surround himself with dumb lieutenants, The Bowery
King and the Harbinger characters are trotted out at the beginning and the end of
the story just to to provide some atmosphere.

Rina Sawayama's acting ability is confined to contorting her face in into pithy
expressions in response to her character's father's philosophical meanderings.
",negative
146,"John Wick first part is the only thing worth watching. What have I watch for 2 and
a half hours in cinema? Only useless gunshots and unrelated actions. Every guy
needs to be shot a least 20 time to be dead. It became annoying to watch so many
guys that were attacking him, shootings with no meaning. And my ears needed
time to recover after so many shooting. Very dissapointed in Keanu Reeves for
accepting this kind of production scenario. The only positive thing here is the dog
that appears 10min total in the whole movie.
",negative
147,"""John Wick: Chapter 4"" is a film that offers what its trailer promises: action and more
action, achieving a product whose production is outstanding, colorful cinematography and
risky camera movements, as well as outstanding editing work and a soundtrack well
done. Its big problem, the negative point, is the most important part: the script, which is
repetitive, tired and unimaginative, exploiting the action theme without really having a
coherent story. Everything ends up being absurd only with a good job in the fight
choreography. An overrated film, practically bad and with an excessive duration for the
null story it tells.
",negative
148,"I loved part 1. Part 2 was also a great movie. Part 3 was questionable at best. They lost
me on part 4.

When he is riding a horse in the dessert his aim is even worse than that of a
stormtrooper. But when he is driving in circels with one hand (in a car with manual
shifting) while shooting out the car his aim is perfect, He can now fall from 4 floors on
concrete of break a car in half shake it of and run some more.

Both Keanus lines and the script only take 1 single page. I read he only speaks about 350
words in 3 hours. And most of the are ""Yeau"".

The end is so predictable. I won't spoil it for you but when you watch the movie you will
know it in 2 hours.

The accent of the ""Marquis"" is so bad. Go to France and listen to French speaking
Englisch/American (if you can find any).
",positive
149,"Too much of something becomes boring.. killing a lot of people becomes boring after a
while.. what's the point?

Hollywood is so satanist that they try to be ale your light as much as they can.. the Cabal
of s about murder and depression, destruction and chaos. tgat of is why God decided
that enough is enough when it comes to all the bad in the world. I we are heading
towards peace and Love and no amount. Of evil can destroy it this time. I am kind of glad

it's the last one in the series because all that killing is counter productive... I mean
what's the point? You live and then you die..!!!!!
",negative
150,"Sure, I was pumped up to see this movie on opening day, but it did not end that way.

Nothing new came to the table. It took too long to get moving, and when it did, all the
fight scenes kinda merged together and the absolute lack of plot took over. So, you end
with hundreds of people fighting in one building. Nothing new and exciting. I should have
just rewatched the older ones.

1 like the ‘kill as many villains as possible’ genre, but for 20 minutes straight, a bunch of
bad guys were all killed in the same fashion. The movie was loud for the sake of being
loud. I would bring earplugs.

The acting does not really exist; The plot does not really exist. The movie became a
lacuna of what it could have been. It's a grand stinker.

I walked out after one hour, picked up some disgusting Panda Express from the mall, and
got home early.
",negative
151,"Such a bad movie. 3 hour long fight where John has put on ""godmode"". Absolutely 0
story, besides just fighting. The whole theatre bursted out laughing because of the
ridiculous fightscenes. I am left so angry and annoyed. Don't you ever go watch this pile
of poop if you like anything that is the slightest realistic. More unrealistic than Marvel
movies. It has absoluty nothing to offer. A blind guy who can fight, shoot and play cards?
What is this? Maybe 12-13 year old kids would find this movie cool. This is as stupid as it
gets. John Wick says nothing in the movie. It is absolutely pointless and meaningless.
",negative
152,"Wow, what a film. Incredible production values and earnest acting and amazing stunts by
all involved. Wardrobe, foley, set designers, editors, and MUAs were all the best of the
best.

And yet the movie was a complete waste of time. I want it to make money for all
involved, but I can't say that it was a good movie by any stretch of the imagination

The American fetishization of guns was in full force here, as was the American hyperbole:
""Make it bigger, make it crazier, make it more wacky."" This film had all of that,
but...character development? Forget about it. A plot that made sense? No way. An
emotional through line? Barely.

It's true that we care about John Wick. We became invested in him four movies ago when
they killed his dog, But watching this film is like watching that dog race around the room
covered in tinsel and holidays lights, barking at shadows.
",positive
153,"Although this movie was not something for me, I was somehow still bored and
underwhelmed.

I fell asleep 3 times during the course of this film and this is due to a number of reasons.
The story and dialogue of the movie are awful, and the only redeeming factor is the
actions sequences, which are well shot and choreographed. However, the awful acting

and. crappy dialogue held back this movie for me.

Sitting in the front row also hurt my viewing experience. The story of this was essentially,
then then then, rather than but therefore or good story structure

I get why ppl may have enjoyed this, but I thought it was a bore and a mess.
",negative
154,"Wick needs to go from spot A to spot B. There are hundreds of enemies trying to kill him.
He will fight against them all alone and will kill them with his weapon. Now he is at the
spot B and needs to go to spot C. There are hundreds of enemies trying to kill him. He
will fight against ther all alone and will kill them with his weapon. Now he is at the spot
C and needs to go to spot D. There are hundreds of enemies trying to kill him. He will
fight against them all alone and will kill them with his weapon. Now he is at the spot D
and needs to go to spot E. Yeah that's the same over and over again for three hours.
Make yourself a favor a skip this movie. Thank me later.
",negative
155,"Absolutely not the best of them. Maybe the worst. Painfully unrealistic, everyone wears
literally bulletproof smokings and the elite guys were recruited out of gardeners, tax
attorneys and university professors judging by their skill to kill with weapons. When in
the first movie John shot each enemy a bullet in the head he now often feels the need to
use 3 bullets (but sometimes they still stand).

As much as I enjoyed the very first John Wick movie as bored I felt during these
extremely long and uninteresting fighting scenes. He is as immortal as Iron Man and with
this leaves all excitement.

And it seems as if the directors were mocking the franchise by letting John fall out of the
4th floor, getting run over by cars, falling down literally 222 steps (I know because they
mention it) of a staircase and all of it just leads to some short heavy breathing but it's
forgotten just 3 seconds later.

None of the characters have personality. Keanus text was probably printed on half a page
and mostly consists of 2 syllabus-responses or the name of the person he's just looking
at.
",negative
156,"Reviews killed this movie so I was expecting more and I was displeased and bored
all the time, ending was fine only. 3 hours for this movie is too much and it's only
gunshots no talking or storytelling just impossible action scenes. I didn't watch
trailer because I saw good reviews and got bored after all. If you guys love movie 3
hours long with no talking with Chuck Norris jokes this is movie for you. Don't
Understand people who likes this movie even 70-80s action movies are better but
they have bad reviews I guess. 5th movie doesn't need to be filmed at all, it's done
he's dead and no need for comeback.
",negative
157,"If you want to see an aging actor move just a bit slower, and his enemies wait to be hit
by him, then you're in for a treat! I think audiences are so used to seeing a guy run up to
Wick to try and punch him with their gun instead of using it from afar that it no longer
looks ridiculous, which it is. Also, apparently, he's bulletproof, and can grab/roll any
number of bad guys he wants to.

The movie long climax scene grows old fast as John Wick now has unlimited stamina, can
almost never be shot, recovers from all injuries, and is now in God Mode. And as anyone
knows, God mode removes any sense of difficulty, suspense, or accomplishment. This
movie is a joke. If the protagonist is never in danger, and can never really be hurt,
there's no tension or drama. Don't waste your time.
",negative
158,"Honestly , there's to much action , not enough sex on screen and Keanu is not a good
actor . The set pieces of this movie was beautiful and again , the fights are well done but
this movie just felt long and pointless . At times I seen about 4 people asleep in the
theaters , then seen half of them pretty Much sleeping . One person puked from the
constant action this movie kept throwing at your face . If you like pointless fights with a
lot of violence , bad acting and terrible written characters , this movie fits right up your
alley! Just bring a blanket , a pillow and get ready for the greatest action nap of your life
",negative
159,"HORRIBLE movie. I love John Wick. I mean I wouldn't pay to see one, but I love
the series none the less. Even liked the third one even though the ending blew
baby chunks. All the 10s and 9s scores are so damn fake it's hilarious. IMDB is a
joke. Someone needs to start a real movie database and weed out the fake high
scores, it's as ridiculous as John Wick 4. He walks away from every major injury or
collision or building fall. Then he passes away from flesh wounds. What nonsense.
The whole plot is nonsense. The fights scene are so boring. I got up to make a
sandwich twice, Just the typical 100 judo throws and same shots to head.
Numerous coup de grace's. I feel sorry for anyone who paid for this nonsense.
",negative
160,"This movie is so bad that I stopped watching it inside the theater to write this review...

What happened here?!? I was so excited to see this movie and now I feel so let down. I
come to see ""John Wick"" films for the immaculate and creative fight choreography. Do
not walk into this movie expecting any of that. All the purism which caused the first three
films to shine is gone. The “John Wick"" franchise has completely disappeared up its own
a*s, This goofy underworld the movies created only worked when a normal world still
existed in the Wick Universe. But there is no ""real world"" anymore. Every single character
in this movie looks cartoonish, like a steampunk caricature of a real person. Even the
villains were painfully cartoonish, one of them even sporting a full mouth full of ridiculous
gold teeth. I couldn't even look at him without laughing.
",negative
161,"Those 3 movies were crafted together to create the 3 hour schemozzle that is John
Wick 4. This is what happens when new blood inherits a simple but wildly popular
character,

Over-compensation when out of ideas. Let's bring in so many characters we can't
keep up with them & bamboozle the optics with the visual delights of vogue cities;
Paris, NY & Tokyo.. This movie betrays everything that was right with the first
movie,

The fight scenes are straight from a 1986 arcade machine with bad guys lined up
patiently to take on our hero & he levels up through every robotic stoush.

The Warriors DJ was my breaking point. My 4th grade self would've loved this crap.
Keanu's better than this
",positive
